{
  "build_runs": [
    {
      "case_results": [
        {
          "catalog_case_id": "DIF-001",
          "label": "constant field gives two zero planes",
          "status": "pass",
          "test_id": "P6-TEST-001"
        },
        {
          "catalog_case_id": "DIF-001",
          "label": "center impulse sign and localization",
          "status": "pass",
          "test_id": "P6-TEST-002"
        },
        {
          "catalog_case_id": "DIF-001",
          "label": "horizontal ramp and one-row edge",
          "status": "pass",
          "test_id": "P6-TEST-003"
        },
        {
          "catalog_case_id": "DIF-001",
          "label": "vertical ramp and one-column edge",
          "status": "pass",
          "test_id": "P6-TEST-004"
        },
        {
          "catalog_case_id": "DIF-001",
          "label": "checkerboard and explicit one-by-one",
          "status": "pass",
          "test_id": "P6-TEST-005"
        },
        {
          "catalog_case_id": "DIF-002",
          "label": "RGB HWC channel order and output shape",
          "status": "pass",
          "test_id": "P6-TEST-006"
        },
        {
          "catalog_case_id": "DIF-002",
          "label": "RGBA channel and alpha-position order",
          "status": "pass",
          "test_id": "P6-TEST-007"
        },
        {
          "catalog_case_id": "DIF-003",
          "label": "seeded RGB byte vector literal oracle",
          "status": "pass",
          "test_id": "P6-TEST-008"
        },
        {
          "catalog_case_id": "DIF-003",
          "label": "deterministic replay preserves exact outputs and work",
          "status": "pass",
          "test_id": "P6-TEST-009"
        },
        {
          "catalog_case_id": "DIF-004",
          "label": "pixels channels elements bytes and work limits",
          "status": "pass",
          "test_id": "P6-TEST-010"
        },
        {
          "catalog_case_id": "DIF-004",
          "label": "unsupported channels and malformed metadata",
          "status": "pass",
          "test_id": "P6-TEST-011"
        },
        {
          "catalog_case_id": "DIF-004",
          "label": "checked arithmetic overflow and empty input",
          "status": "pass",
          "test_id": "P6-TEST-012"
        },
        {
          "catalog_case_id": "DIF-005",
          "label": "cancellation and expired deadline are atomic",
          "status": "pass",
          "test_id": "P6-TEST-013"
        }
      ],
      "compile_command": [
        "/usr/bin/x86_64-linux-gnu-g++-13",
        "-std=c++20",
        "-Wall",
        "-Wextra",
        "-Wpedantic",
        "-Wconversion",
        "-Wsign-conversion",
        "-Wshadow",
        "-Werror",
        "-O2",
        "/workspace/AGI-Core/Image/SPEC/p4/raster_admission.cpp",
        "/workspace/AGI-Core/Image/SPEC/p5/canonical_raster.cpp",
        "/workspace/AGI-Core/Image/SPEC/p6/forward_difference.cpp",
        "/workspace/AGI-Core/Image/SPEC/harness/p6/test_forward_difference.cpp",
        "-o",
        "/tmp/image-vision-p6-dr61vp_z/p6-normal"
      ],
      "compiler_output": "",
      "dynamic_link_dependencies": [
        "linux-vdso.so.1",
        "libstdc++.so.6",
        "libc.so.6",
        "libm.so.6",
        "/lib64/ld-linux-x86-64.so.2",
        "libgcc_s.so.1"
      ],
      "elapsed_ms": 1.928,
      "exit_code": 0,
      "mode": "normal",
      "status": "pass",
      "stderr": "",
      "stdout": "CASE\tP6-TEST-001\tpass\tDIF-001\tconstant field gives two zero planes\nCASE\tP6-TEST-002\tpass\tDIF-001\tcenter impulse sign and localization\nCASE\tP6-TEST-003\tpass\tDIF-001\thorizontal ramp and one-row edge\nCASE\tP6-TEST-004\tpass\tDIF-001\tvertical ramp and one-column edge\nCASE\tP6-TEST-005\tpass\tDIF-001\tcheckerboard and explicit one-by-one\nCASE\tP6-TEST-006\tpass\tDIF-002\tRGB HWC channel order and output shape\nCASE\tP6-TEST-007\tpass\tDIF-002\tRGBA channel and alpha-position order\nCASE\tP6-TEST-008\tpass\tDIF-003\tseeded RGB byte vector literal oracle\nCASE\tP6-TEST-009\tpass\tDIF-003\tdeterministic replay preserves exact outputs and work\nCASE\tP6-TEST-010\tpass\tDIF-004\tpixels channels elements bytes and work limits\nCASE\tP6-TEST-011\tpass\tDIF-004\tunsupported channels and malformed metadata\nCASE\tP6-TEST-012\tpass\tDIF-004\tchecked arithmetic overflow and empty input\nCASE\tP6-TEST-013\tpass\tDIF-005\tcancellation and expired deadline are atomic\nSUMMARY\t13\t13\n"
    },
    {
      "case_results": [
        {
          "catalog_case_id": "DIF-001",
          "label": "constant field gives two zero planes",
          "status": "pass",
          "test_id": "P6-TEST-001"
        },
        {
          "catalog_case_id": "DIF-001",
          "label": "center impulse sign and localization",
          "status": "pass",
          "test_id": "P6-TEST-002"
        },
        {
          "catalog_case_id": "DIF-001",
          "label": "horizontal ramp and one-row edge",
          "status": "pass",
          "test_id": "P6-TEST-003"
        },
        {
          "catalog_case_id": "DIF-001",
          "label": "vertical ramp and one-column edge",
          "status": "pass",
          "test_id": "P6-TEST-004"
        },
        {
          "catalog_case_id": "DIF-001",
          "label": "checkerboard and explicit one-by-one",
          "status": "pass",
          "test_id": "P6-TEST-005"
        },
        {
          "catalog_case_id": "DIF-002",
          "label": "RGB HWC channel order and output shape",
          "status": "pass",
          "test_id": "P6-TEST-006"
        },
        {
          "catalog_case_id": "DIF-002",
          "label": "RGBA channel and alpha-position order",
          "status": "pass",
          "test_id": "P6-TEST-007"
        },
        {
          "catalog_case_id": "DIF-003",
          "label": "seeded RGB byte vector literal oracle",
          "status": "pass",
          "test_id": "P6-TEST-008"
        },
        {
          "catalog_case_id": "DIF-003",
          "label": "deterministic replay preserves exact outputs and work",
          "status": "pass",
          "test_id": "P6-TEST-009"
        },
        {
          "catalog_case_id": "DIF-004",
          "label": "pixels channels elements bytes and work limits",
          "status": "pass",
          "test_id": "P6-TEST-010"
        },
        {
          "catalog_case_id": "DIF-004",
          "label": "unsupported channels and malformed metadata",
          "status": "pass",
          "test_id": "P6-TEST-011"
        },
        {
          "catalog_case_id": "DIF-004",
          "label": "checked arithmetic overflow and empty input",
          "status": "pass",
          "test_id": "P6-TEST-012"
        },
        {
          "catalog_case_id": "DIF-005",
          "label": "cancellation and expired deadline are atomic",
          "status": "pass",
          "test_id": "P6-TEST-013"
        }
      ],
      "compile_command": [
        "/usr/bin/x86_64-linux-gnu-g++-13",
        "-std=c++20",
        "-Wall",
        "-Wextra",
        "-Wpedantic",
        "-Wconversion",
        "-Wsign-conversion",
        "-Wshadow",
        "-Werror",
        "-O2",
        "-fsanitize=address,undefined",
        "-fno-omit-frame-pointer",
        "-g",
        "/workspace/AGI-Core/Image/SPEC/p4/raster_admission.cpp",
        "/workspace/AGI-Core/Image/SPEC/p5/canonical_raster.cpp",
        "/workspace/AGI-Core/Image/SPEC/p6/forward_difference.cpp",
        "/workspace/AGI-Core/Image/SPEC/harness/p6/test_forward_difference.cpp",
        "-o",
        "/tmp/image-vision-p6-dr61vp_z/p6-address_undefined_sanitizers"
      ],
      "compiler_output": "",
      "dynamic_link_dependencies": [
        "linux-vdso.so.1",
        "libasan.so.8",
        "libstdc++.so.6",
        "libm.so.6",
        "libubsan.so.1",
        "libgcc_s.so.1",
        "libc.so.6",
        "/lib64/ld-linux-x86-64.so.2"
      ],
      "elapsed_ms": 14.586,
      "exit_code": 0,
      "mode": "address_undefined_sanitizers",
      "status": "pass",
      "stderr": "",
      "stdout": "CASE\tP6-TEST-001\tpass\tDIF-001\tconstant field gives two zero planes\nCASE\tP6-TEST-002\tpass\tDIF-001\tcenter impulse sign and localization\nCASE\tP6-TEST-003\tpass\tDIF-001\thorizontal ramp and one-row edge\nCASE\tP6-TEST-004\tpass\tDIF-001\tvertical ramp and one-column edge\nCASE\tP6-TEST-005\tpass\tDIF-001\tcheckerboard and explicit one-by-one\nCASE\tP6-TEST-006\tpass\tDIF-002\tRGB HWC channel order and output shape\nCASE\tP6-TEST-007\tpass\tDIF-002\tRGBA channel and alpha-position order\nCASE\tP6-TEST-008\tpass\tDIF-003\tseeded RGB byte vector literal oracle\nCASE\tP6-TEST-009\tpass\tDIF-003\tdeterministic replay preserves exact outputs and work\nCASE\tP6-TEST-010\tpass\tDIF-004\tpixels channels elements bytes and work limits\nCASE\tP6-TEST-011\tpass\tDIF-004\tunsupported channels and malformed metadata\nCASE\tP6-TEST-012\tpass\tDIF-004\tchecked arithmetic overflow and empty input\nCASE\tP6-TEST-013\tpass\tDIF-005\tcancellation and expired deadline are atomic\nSUMMARY\t13\t13\n"
    }
  ],
  "case_results": [
    {
      "catalog_case_id": "DIF-001",
      "label": "constant field gives two zero planes",
      "status": "pass",
      "test_id": "P6-TEST-001"
    },
    {
      "catalog_case_id": "DIF-001",
      "label": "center impulse sign and localization",
      "status": "pass",
      "test_id": "P6-TEST-002"
    },
    {
      "catalog_case_id": "DIF-001",
      "label": "horizontal ramp and one-row edge",
      "status": "pass",
      "test_id": "P6-TEST-003"
    },
    {
      "catalog_case_id": "DIF-001",
      "label": "vertical ramp and one-column edge",
      "status": "pass",
      "test_id": "P6-TEST-004"
    },
    {
      "catalog_case_id": "DIF-001",
      "label": "checkerboard and explicit one-by-one",
      "status": "pass",
      "test_id": "P6-TEST-005"
    },
    {
      "catalog_case_id": "DIF-002",